{
  "schema": "safehome.rc0810.security-baseline.v1",
  "phase": "F22-A",
  "captured_at": "2026-08-10T13:43:15.885770+00:00",
  "head": "4a17b9faf9187a5d414f92e84ff7b08e60802d49",
  "head_tree": "259930bae3a4baf2cbac53e01d6806ab8cbce1f0",
  "source_tree": "e76b3ff3ebd0d91624832d62f69b7fc344da84f7",
  "dirty_diff_sha256": "f38ac2e8c6131a418fc137a9a1b4fbb23411bb42b7dcee23972ddd89b21476db",
  "source_manifest_sha256": "ac8280c1b8ee03ab332d7dd34023a54e7a26219e3d2a3008ed20131a5f8ffae4",
  "policy_sha256": "2acb7003d6314c86a0095be80c34db55d9694bd3ffb2aa5f03f903835d679914",
  "exception_registry_sha256": "980783bd924cbaf21048f34ef646a1a3fc5091d45e3a2d60f2ebaad7d7e9f9b9",
  "dependency_inputs": {
    "backend/requirements.txt": "e15a0bd5832f476c7d863c3c672de993462af34bc20083cf56eb6429807190ef",
    "analysis/profiling/requirements.txt": "868f7575d70370908aa327a850dd9a45c64c28a88b96ae195acb6ae7cb0c6ba1",
    "analysis/text_analysis/requirements.txt": "c3b8dce819af68270508b17ca4d1d6ce4f026fea864e839803010e1be2002641",
    "apps/web/package-lock.json": "99ac985d93c62e2b4d69da0b5201ef160e517533dbebd2066822a1a9e93b92a5",
    "Dockerfile": "a9637bc2c4e3fbf15c4ed273806d5ef26c069cbb5336a2f6ca5d8a953d56c988"
  },
  "raw_reports": [
    {
      "tool": "detect-secrets",
      "version": "1.5.0",
      "path": "D:\\codex\\workspace\\safehome1.0\\.codex_tmp\\rc0810\\security\\f22a\\e76b3ff3ebd0d91624832d62f69b7fc344da84f7\\reports\\detect-secrets.json",
      "sha256": "0ad4187fc26efb03662da03aa623913ea755a3b5b48ebb0b2fc1700548104da0",
      "bytes": 69597,
      "exit_code": 0,
      "command": [
        "D:\\python\\anada\\python.exe",
        "-m",
        "detect_secrets",
        "scan",
        "--all-files",
        "D:\\codex\\workspace\\safehome1.0\\.codex_tmp\\rc0810\\security\\f22a\\e76b3ff3ebd0d91624832d62f69b7fc344da84f7\\staging"
      ],
      "source_tree": "e76b3ff3ebd0d91624832d62f69b7fc344da84f7",
      "captured_at": "2026-08-10T13:43:15.885770+00:00"
    },
    {
      "tool": "bandit",
      "version": "1.9.4",
      "path": "D:\\codex\\workspace\\safehome1.0\\.codex_tmp\\rc0810\\security\\f22a\\e76b3ff3ebd0d91624832d62f69b7fc344da84f7\\reports\\bandit.json",
      "sha256": "8a5a8eb67a81c036f572eb5d0b628ef240a3714cd4090ecac6483ff75859e029",
      "bytes": 6189666,
      "exit_code": 1,
      "command": [
        "D:\\python\\anada\\python.exe",
        "-m",
        "bandit",
        "-r",
        "D:\\codex\\workspace\\safehome1.0\\.codex_tmp\\rc0810\\security\\f22a\\e76b3ff3ebd0d91624832d62f69b7fc344da84f7\\staging\\backend",
        "D:\\codex\\workspace\\safehome1.0\\.codex_tmp\\rc0810\\security\\f22a\\e76b3ff3ebd0d91624832d62f69b7fc344da84f7\\staging\\scripts",
        "D:\\codex\\workspace\\safehome1.0\\.codex_tmp\\rc0810\\security\\f22a\\e76b3ff3ebd0d91624832d62f69b7fc344da84f7\\staging\\analysis",
        "-f",
        "json"
      ],
      "source_tree": "e76b3ff3ebd0d91624832d62f69b7fc344da84f7",
      "captured_at": "2026-08-10T13:43:15.885770+00:00"
    },
    {
      "tool": "pip-audit",
      "version": "2.10.1",
      "path": "D:\\codex\\workspace\\safehome1.0\\.codex_tmp\\rc0810\\security\\f22a\\e76b3ff3ebd0d91624832d62f69b7fc344da84f7\\reports\\pip-audit.json",
      "sha256": "ad94c7e31bdadb2d7b0749c94201306b5d00f8f1430db0a684429c041bf6339a",
      "bytes": 2101,
      "exit_code": 0,
      "command": [
        "D:\\python\\anada\\python.exe",
        "-m",
        "pip_audit",
        "-r",
        "D:\\codex\\workspace\\safehome1.0\\.codex_tmp\\rc0810\\security\\f22a\\e76b3ff3ebd0d91624832d62f69b7fc344da84f7\\staging\\backend\\requirements.txt",
        "-r",
        "D:\\codex\\workspace\\safehome1.0\\.codex_tmp\\rc0810\\security\\f22a\\e76b3ff3ebd0d91624832d62f69b7fc344da84f7\\staging\\analysis\\profiling\\requirements.txt",
        "-r",
        "D:\\codex\\workspace\\safehome1.0\\.codex_tmp\\rc0810\\security\\f22a\\e76b3ff3ebd0d91624832d62f69b7fc344da84f7\\staging\\analysis\\text_analysis\\requirements.txt",
        "--format",
        "json",
        "--progress-spinner",
        "off"
      ],
      "source_tree": "e76b3ff3ebd0d91624832d62f69b7fc344da84f7",
      "captured_at": "2026-08-10T13:43:15.885770+00:00"
    },
    {
      "tool": "npm-audit",
      "version": "11.13.0",
      "path": "D:\\codex\\workspace\\safehome1.0\\.codex_tmp\\rc0810\\security\\f22a\\e76b3ff3ebd0d91624832d62f69b7fc344da84f7\\reports\\npm-audit.json",
      "sha256": "fe256bf6f2a79e95dcabddc7516df1e38f2a050efd18b9fa2ed71300760f2791",
      "bytes": 363,
      "exit_code": 0,
      "command": [
        "npm.cmd",
        "audit",
        "--json",
        "--package-lock-only"
      ],
      "source_tree": "e76b3ff3ebd0d91624832d62f69b7fc344da84f7",
      "captured_at": "2026-08-10T13:43:15.885770+00:00"
    }
  ],
  "negative_gate_evidence": {
    "source_tree": "e76b3ff3ebd0d91624832d62f69b7fc344da84f7",
    "reports": [
      {
        "tool": "detect-secrets",
        "version": "1.5.0",
        "path": "D:\\codex\\workspace\\safehome1.0\\.codex_tmp\\rc0810\\security\\f22a\\e76b3ff3ebd0d91624832d62f69b7fc344da84f7\\reports\\negative-detect-secrets.json",
        "sha256": "24fbd9d584e0f1cfb8797761085b2d619db432787dc01b1826e4810b650c580a",
        "bytes": 2816,
        "exit_code": 0,
        "command": [
          "D:\\python\\anada\\python.exe",
          "-m",
          "detect_secrets",
          "scan",
          "--all-files",
          "D:\\codex\\workspace\\safehome1.0\\.codex_tmp\\rc0810\\security\\f22a\\e76b3ff3ebd0d91624832d62f69b7fc344da84f7\\negative-fixtures\\fake-secret.txt"
        ],
        "source_tree": "e76b3ff3ebd0d91624832d62f69b7fc344da84f7",
        "captured_at": "2026-08-10T13:43:15.885770+00:00"
      },
      {
        "tool": "bandit",
        "version": "1.9.4",
        "path": "D:\\codex\\workspace\\safehome1.0\\.codex_tmp\\rc0810\\security\\f22a\\e76b3ff3ebd0d91624832d62f69b7fc344da84f7\\reports\\negative-bandit.json",
        "sha256": "aa47087ac778f2a98e379b34243ae716351275269100d31d2a0575981b1ea196",
        "bytes": 2614,
        "exit_code": 1,
        "command": [
          "D:\\python\\anada\\python.exe",
          "-m",
          "bandit",
          "-r",
          "D:\\codex\\workspace\\safehome1.0\\.codex_tmp\\rc0810\\security\\f22a\\e76b3ff3ebd0d91624832d62f69b7fc344da84f7\\negative-fixtures\\dangerous.py",
          "-f",
          "json"
        ],
        "source_tree": "e76b3ff3ebd0d91624832d62f69b7fc344da84f7",
        "captured_at": "2026-08-10T13:43:15.885770+00:00"
      },
      {
        "tool": "pip-audit",
        "version": "2.10.1",
        "path": "D:\\codex\\workspace\\safehome1.0\\.codex_tmp\\rc0810\\security\\f22a\\e76b3ff3ebd0d91624832d62f69b7fc344da84f7\\reports\\negative-pip-audit.json",
        "sha256": "c40988c0c8ec1cd25e71a3b623af10f5a1cd8b356595a4e9a4ee9d3461b32603",
        "bytes": 222,
        "exit_code": 1,
        "command": [
          "D:\\python\\anada\\python.exe",
          "-m",
          "pip_audit",
          "-r",
          "D:\\codex\\workspace\\safehome1.0\\.codex_tmp\\rc0810\\security\\f22a\\e76b3ff3ebd0d91624832d62f69b7fc344da84f7\\negative-fixtures\\requirements.txt",
          "--format",
          "json",
          "--progress-spinner",
          "off",
          "--no-deps",
          "--disable-pip",
          "--vulnerability-service",
          "osv",
          "--osv-url",
          "http://127.0.0.1:63630/v1/query"
        ],
        "source_tree": "e76b3ff3ebd0d91624832d62f69b7fc344da84f7",
        "captured_at": "2026-08-10T13:43:15.885770+00:00"
      }
    ],
    "checks": {
      "fake_secret_fixture_rejected": true,
      "high_sast_fixture_rejected": true,
      "high_dependency_fixture_rejected": true
    }
  },
  "blocking_findings": [
    {
      "finding_id": "sast:152943a77fe5a384b4157aad",
      "category": "sast",
      "severity": "high",
      "fingerprint": "152943a77fe5a384b4157aad8187e60e763a85cf3c5f19ce549b18b80ba8fd37",
      "source_tree": "e76b3ff3ebd0d91624832d62f69b7fc344da84f7"
    },
    {
      "finding_id": "sast:471b4fd40b1b9880310584a4",
      "category": "sast",
      "severity": "high",
      "fingerprint": "471b4fd40b1b9880310584a46744fea34da260c91983561a036630d451ecb396",
      "source_tree": "e76b3ff3ebd0d91624832d62f69b7fc344da84f7"
    },
    {
      "finding_id": "sast:c6d20cde7a9ec12adc1f4121",
      "category": "sast",
      "severity": "high",
      "fingerprint": "c6d20cde7a9ec12adc1f41216eb0921bc7c645efc70ee5ba01391aecf0ccd293",
      "source_tree": "e76b3ff3ebd0d91624832d62f69b7fc344da84f7"
    },
    {
      "finding_id": "secret:01b577ec1b1fda53a5a52f4c",
      "category": "secret",
      "severity": "unknown",
      "fingerprint": "01b577ec1b1fda53a5a52f4cb9224e3b03ea0dcf94c4c04dd2037fca96efabec",
      "source_tree": "e76b3ff3ebd0d91624832d62f69b7fc344da84f7"
    },
    {
      "finding_id": "secret:03896e6da6d2d42ced5ee1c7",
      "category": "secret",
      "severity": "unknown",
      "fingerprint": "03896e6da6d2d42ced5ee1c78004d2194110afa95229c31bfc289fe0a71a5f01",
      "source_tree": "e76b3ff3ebd0d91624832d62f69b7fc344da84f7"
    },
    {
      "finding_id": "secret:043f75767525b68d7369ed88",
      "category": "secret",
      "severity": "unknown",
      "fingerprint": "043f75767525b68d7369ed881bf470e76944465e8b4e3863c2daca55bf108c68",
      "source_tree": "e76b3ff3ebd0d91624832d62f69b7fc344da84f7"
    },
    {
      "finding_id": "secret:04ccc9a9f7a0d33ee14e12e8",
      "category": "secret",
      "severity": "unknown",
      "fingerprint": "04ccc9a9f7a0d33ee14e12e81cf1c3b73507a91c45d216e66e80313250e47b18",
      "source_tree": "e76b3ff3ebd0d91624832d62f69b7fc344da84f7"
    },
    {
      "finding_id": "secret:0505a8111fb7dcf43fbb2b50",
      "category": "secret",
      "severity": "unknown",
      "fingerprint": "0505a8111fb7dcf43fbb2b5004253b6249d24a5ba10f5d1cb057ba3067a94b85",
      "source_tree": "e76b3ff3ebd0d91624832d62f69b7fc344da84f7"